Date,User,Message
2021-12-11 15:45:30,김가람,"여러분, 이번 학기에 파이썬으로 데이터 분석을 배우는 수업을 듣자고 했잖아요."
2021-12-11 15:48:39,이나람,"네, 저도 들었어요. 파이썬이 데이터 분석에 굉장히 유용하다고 하더라고요."
2021-12-11 15:51:59,박다람,정말요? 저는 프로그래밍에 대해 잘 몰라요. 파이썬이 뭐에요?
2021-12-11 15:53:05,김가람,"파이썬은 초보자도 배우기 쉬운 프로그래밍 언어예요. 데이터 분석, 웹 개발, 인공 지능 개발 등 여러 분야에서 널리 사용되고 있죠."
2021-12-11 15:55:49,이나람,맞아요. 그리고 파이썬은 많은 데이터 분석 라이브러리와 프레임워크를 지원해서 데이터 과학자들 사이에서 인기가 많아요.
2021-12-11 15:59:49,박다람,그럼 데이터 분석이란 정확히 무엇인가요?
2021-12-11 16:02:50,김가람,"데이터 분석은 데이터에서 유용한 정보를 찾아내고, 그 정보를 기반으로 결정을 내리거나 예측하는 과정이에요."
2021-12-11 16:06:26,이나람,"예를 들어, 기업들은 고객 데이터를 분석해서 고객의 구매 패턴을 파악하고, 그에 맞는 마케팅 전략을 세울 수 있어요."
2021-12-11 16:08:16,박다람,"오, 그렇군요. 그런데 왜 파이썬을 배워야 하나요?"
2021-12-11 16:11:10,김가람,파이썬은 문법이 단순하고 읽기 쉬워서 배우기 시작하기 좋아요. 또한 강력한 데이터 분석 라이브러리를 많이 가지고 있어요.
2021-12-11 16:15:10,이나람,"네, 예를 들어, pandas는 데이터 처리와 분석을 위한 라이브러리고, NumPy는 수치 계산을 위한 라이브러리예요. Matplotlib와 Seaborn은 데이터를 시각화하기 위한 도구예요."
2021-12-11 16:18:39,박다람,그럼 우리는 어떻게 시작해야 할까요?
2021-12-11 16:21:56,김가람,먼저 기본적인 파이썬 문법부터 시작해보는 게 어때요? 온라인에는 무료로 배울 수 있는 자료가 많아요.
2021-12-11 16:25:00,이나람,좋아요. 그리고 데이터 분석에 대한 기초적인 이해도 필요할 것 같아요.
2021-12-11 16:26:59,박다람,"네, 저도 동의해요. 우리 모두 함께 배우면서 프로젝트도 해보면 어떨까요?"
2021-12-11 16:28:34,김가람,좋은 생각이에요! 실제 데이터를 가지고 분석해보면 더 많이 배울 수 있을 거예요.
2021-12-11 16:30:59,이나람,그럼 우리의 첫 프로젝트는 무엇으로 할까요?
2021-12-11 16:34:06,박다람,어떤 데이터를 사용할 수 있나요?
2021-12-11 16:37:37,김가람,"공공 데이터 포털 같은 곳에서 무료로 제공하는 데이터를 사용할 수 있어요. 예를 들어, 기후 데이터나 소셜 미디어 데이터 등이 있죠."
2021-12-11 16:40:54,이나람,"오, 소셜 미디어 데이터를 분석해보는 것도 재미있을 것 같아요. 사람들의 관심사나 트렌드를 분석해볼 수 있을 것 같아요."
2021-12-11 16:43:39,박다람,저는 기후 데이터 분석에도 관심이 많아요. 기후 변화에 대한 인식을 높이는 데 기여할 수도 있을 것 같아요.
2021-12-11 16:47:16,박다람,그런데 파이썬을 배우기 시작하면 정말 기후 데이터 분석 같은 걸 할 수 있게 되나요? 저는 아직도 어디서부터 시작해야 할지 막막해요.
2021-12-11 16:49:42,김가람,"그런 기분 잘 알아요. 파이썬은 정말 다재다능한 언어라, 기초만 잘 다져도 여러 분야에서 활용할 수 있어요. 기후 데이터 분석도 예외는 아니죠."
2021-12-11 16:52:01,이나람,"맞아요, 파이썬은 데이터 분석부터 웹 개발까지 정말 많은 분야에서 쓰여요. 우선은 파이썬의 기본적인 문법을 익히는 것부터 시작하면 어떨까요?"
2021-12-11 16:53:30,박다람,기본 문법이라... 예를 들면 무엇을 배워야 하나요?
2021-12-11 16:55:02,김가람,"변수, 데이터 타입, 조건문, 반복문 같은 기초적인 프로그래밍 개념부터 시작하면 좋아요. 이런 것들은 모든 프로그래밍 언어의 기본이 되는 거니까요."
2021-12-11 16:56:09,이나람,그리고 함수를 만드는 방법이나 모듈을 사용하는 방법도 중요해요. 이런 것들을 배우면 코드를 더 효율적으로 작성할 수 있게 돼요.
2021-12-11 16:57:58,박다람,함수와 모듈이라... 솔직히 말하면 아직은 그게 무엇인지 잘 모르겠어요.
2021-12-11 17:00:29,김가람,"걱정마세요, 모두 그렇게 시작해요. 함수는 특정 작업을 수행하는 코드의 묶음이고, 모듈은 함수나 변수들을 모아 놓은 파일이라고 생각하면 돼요."
2021-12-11 17:02:15,이나람,"저도 처음에는 모든 게 복잡하고 어려워 보였어요. 하지만 한 단계씩 차근차근 배워나가다 보니, 점점 더 많은 것을 할 수 있게 되더라고요."
2021-12-11 17:05:11,박다람,"그럼 데이터 분석은 어떻게 시작하나요? 데이터를 어떻게 다루고, 분석하는 건가요?"
2021-12-11 17:07:06,김가람,"데이터 분석을 시작하려면 우선 데이터를 이해해야 해요. 예를 들어, 어떤 데이터를 분석할 것인지, 그 데이터에서 무엇을 알아내고 싶은지 정하는 거죠."
2021-12-11 17:10:20,이나람,"그리고 pandas 같은 라이브러리를 사용하면 데이터를 쉽게 다룰 수 있어요. 데이터를 정리하고, 필요한 정보를 추출하는 작업이 훨씬 간편해져요."
2021-12-11 17:12:58,박다람,pandas라... 그게 정확히 무엇을 하는 건가요?
2021-12-11 17:16:22,김가람,"pandas는 파이썬에서 데이터 분석을 할 때 사용하는 라이브러리예요. 표 같은 데이터를 다루기 정말 좋아요. 예를 들어, 엑셀 데이터를 파이썬에서 읽고, 처리할 수 있게 해줘요."
2021-12-11 17:20:14,이나람,"데이터를 분석하려면 데이터 시각화도 중요해요. Matplotlib이나 Seaborn 같은 라이브러리를 사용하면 데이터를 그래프로 표현할 수 있어서, 분석 결과를 더 잘 이해할 수 있어요."
2021-12-11 17:24:09,박다람,그래프로요? 그게 정말 가능한가요? 저는 그림을 그리는 것도 서툴러서...
2021-12-11 17:26:07,김가람,"걱정하지 마세요, 프로그래밍으로 그래프를 그리는 건 직접 그림을 그리는 것과는 완전히 다른 거예요. 코드 몇 줄만으로 멋진 그래프를 만들 수 있어요."
2021-12-11 17:28:42,이나람,"네, 코드에 데이터를 넣고 어떤 유형의 그래프를 그릴지 정하기만 하면 돼요. 나머지는 라이브러리가 알아서 해줘요."
2021-12-11 17:32:35,박다람,"정말 그렇게 할 수 있다면, 저도 기후 데이터를 가지고 무언가 해보고 싶어지네요. 어떤 주제로 시작하는 게 좋을까요?"
2021-12-11 17:35:55,김가람,"기후 변화에 대한 인식을 높이고 싶다면, 지구 온난화에 대한 데이터를 분석해볼 수 있어요. 예를 들어, 지난 몇 년간의 기온 변화를 분석해보는 거죠."
2021-12-11 17:39:12,이나람,또는 미세먼지 수치 변화를 분석해볼 수도 있어요. 공공 데이터 포털에서 환경 관련 데이터를 찾아볼 수 있을 거예요.
2021-12-11 17:40:34,박다람,그런 데이터를 어떻게 찾아야 하나요? 데이터를 구하는 것부터가 벌써 어려워 보여요.
2021-12-11 17:44:05,김가람,"걱정마세요, 많은 정부 기관이나 연구소에서 공개하는 데이터가 많아요. 공공 데이터 포털이나 기후 관련 연구 기관의 웹사이트에서 찾을 수 있어요."
2021-12-11 17:46:25,이나람,그리고 데이터를 찾을 때 중요한 것은 데이터의 출처와 정확성이에요. 신뢰할 수 있는 출처에서 데이터를 가져오는 것이 중요해요.
2021-12-11 17:49:20,박다람,"아, 그렇군요. 데이터의 출처도 중요하다... 저는 아직 배울 것이 정말 많네요."
2021-12-11 17:52:47,김가람,우리 모두 처음부터 배우는 거니까요. 서로 도와가면서 배우면 좋겠어요.
2021-12-11 17:54:12,이나람,"네, 저도 동의해요. 함께 공부하면서 서로 질문하고 답해주면, 더 많이 배울 수 있을 거예요."
2021-12-11 17:56:18,박다람,"정말 그렇게 할 수 있으면 좋겠네요. 함께 공부하는 동안 저도 많이 배우고, 기후 변화에 대한 좋은 분석도 해보고 싶어요."
2021-12-11 17:58:07,김가람,"그럼, 우리의 첫 프로젝트 주제를 기후 변화 데이터 분석으로 정하는 건 어때요?"
2021-12-11 18:01:07,이나람,"좋아요, 그 주제로 정하고 각자 할 수 있는 부분부터 시작해보죠."
2021-12-11 18:03:34,박다람,"네, 저도 열심히 할게요. 우리 모두 파이팅이에요!"
2021-12-11 18:07:29,김가람,"정말 좋아요! 우리 모두의 첫 프로젝트니까, 서로 많이 도와주고 응원해요."
2021-12-11 18:09:21,이나람,"분명히 어려움도 많을 거예요. 처음 배우는 거니까요. 하지만 포기하지 말고, 서로 질문 많이 해요!"
2021-12-11 18:13:13,박다람,"맞아요, 저도 처음에는 'Hello, World!' 프로그램조차 제대로 실행시키는 게 어려웠어요."
2021-12-11 18:15:33,김가람,"그런 경험, 모두 겪는 거예요. 저도 파이썬 설치할 때 환경 변수 설정에서 한참 헤맸답니다."
2021-12-11 18:19:22,이나람,"데이터 분석하려고 pandas 처음 썼을 때, 그 많은 함수들 보고 머리가 어질어질했어요. 하지만 하다 보니까 조금씩 이해가 되더라고요."
2021-12-11 18:22:29,박다람,"저는 Matplotlib으로 그래프 그리려고 했는데, 코드 한 줄 한 줄이 마치 외계어 같았어요. 그래도 여러 번 시도하고 나니까 제대로 그래프가 그려지더라고요!"
2021-12-11 18:24:46,김가람,"그래요, 우리 모두 처음부터 완벽할 수는 없어요. 중요한 건 포기하지 않고 계속 시도하는 거죠."
2021-12-11 18:28:46,이나람,"네, 저도 배워가는 과정에서 구글링이 제일 친한 친구가 됐어요. 어떤 에러 메시지를 보더라도 차분히 해결 방법을 찾아보는 거죠."
2021-12-11 18:32:13,박다람,"정말 그래요. 에러 메시지가 뜰 때마다 심장이 철렁 내려앉긴 하지만, 그걸 해결했을 때의 성취감이 정말 대단해요!"
2021-12-11 18:35:42,김가람,"맞아요, 에러 메시지를 해결해 나가는 과정에서 실력이 향상되고, 그 과정 자체가 배움이에요."
2021-12-11 18:38:54,이나람,"그리고 우리가 함께 프로젝트를 하면서 서로 겪는 어려움을 공유하고, 해결책을 찾아가는 것도 정말 중요해요."
2021-12-11 18:40:14,박다람,"네, 서로의 경험을 공유하면 더 많은 것을 배울 수 있을 거예요. 그리고 우리의 첫 프로젝트가 끝나면, 얼마나 많이 성장했는지 볼 수 있을 거예요."
2021-12-11 18:41:46,김가람,"정말 기대되네요. 우리의 첫 프로젝트가 어떤 결과를 가져올지, 어떤 어려움을 겪게 될지 모르겠지만, 함께라면 충분히 극복할 수 있을 거예요."
2021-12-11 18:43:55,이나람,"네, 모두 화이팅입니다! 이번 프로젝트를 통해 좋은 경험 많이 만들어봐요."
2021-12-11 18:45:59,박다람,"그래요, 모두 함께라면 어떤 어려움도 극복할 수 있어요. 우리의 첫 데이터 분석 프로젝트, 정말 기대돼요!"
2021-12-11 18:49:00,김가람,"그럼 다음 모임 때까지 각자 할 수 있는 부분을 좀 더 탐색해보고 오기로 해요. 그리고 모여서 각자 어떤 어려움을 겪었는지, 어떤 발견을 했는지 공유하는 시간을 가지죠."
2021-12-11 18:52:07,이나람,"좋아요, 그리고 우리가 배운 것들을 어떻게 프로젝트에 적용할 수 있을지도 함께 논의해봐요."
2021-12-11 18:55:40,박다람,"네, 그럼 모두 다음 모임까지 건강하게 잘 지내고, 많이 배워와서 공유해요. 이번 주말에 봐요!"
2021-12-11 18:59:24,김가람,"네, 다들 파이팅입니다! 주말에 뵙겠습니다."
2021-12-11 19:02:18,이나람,"주말에 뵙겠습니다, 모두 파이팅!"
2021-12-11 19:05:48,박다람,"네, 그럼 모두 다음 모임까지 각자 할 수 있는 부분을 좀 더 탐색해보고 오기로 해요. 그리고 모여서 각자 어떤 어려움을 겪었는지, 어떤 발견을 했는지 공유하는 시간을 가지죠."
2021-12-11 19:08:12,김가람,"좋아요, 그리고 우리가 배운 것들을 어떻게 프로젝트에 적용할 수 있을지도 함께 논의해봐요."
2021-12-11 19:09:44,이나람,"네, 그럼 모두 다음 모임까지 건강하게 잘 지내고, 많이 배워와서 공유해요. 이번 주말에 봐요!"
2021-12-11 19:12:48,박다람,정말 기대되네요. 우리가 이번 프로젝트를 통해 얼마나 많은 것을 배울 수 있을지 상상만 해도 벌써부터 뿌듯해요.
2021-12-11 19:15:20,김가람,"저도요! 우리가 함께라면 어떤 어려움도 극복할 수 있을 거예요. 서로 의지하면서, 한 걸음씩 나아가 봅시다."
2021-12-11 19:18:51,이나람,"저는 데이터를 어떻게 분석해야 할지, 어떤 인사이트를 뽑아낼 수 있을지 고민되기 시작했어요. 하지만 이런 고민을 서로 나누면서 해결해 나갈 수 있겠죠."
2021-12-11 19:20:51,박다람,분명 처음에는 모든 게 어렵고 복잡하게 느껴질 거예요. 하지만 그 과정 속에서 우리는 더 많이 성장할 수 있을 거라고 믿어요.
2021-12-11 19:22:47,김가람,"저도 동의해요. 우리가 서로 지식을 공유하고, 함께 문제를 해결해 나간다면, 이번 프로젝트를 성공적으로 마칠 수 있을 거예요."
2021-12-11 19:24:03,이나람,"그래요, 우리 모두 각자의 경험과 지식을 쌓아가면서, 이번 프로젝트를 통해 멋진 결과를 만들어 냅시다."
2021-12-11 19:27:22,박다람,"그럼, 다음 모임에서는 각자 연구한 내용을 공유하고, 프로젝트의 방향성에 대해 더 깊이 논의해보아요."
2021-12-11 19:29:01,김가람,"네, 모두들 준비 잘 해오세요. 우리의 첫 프로젝트니만큼, 모두의 의견과 아이디어가 중요해요."
2021-12-11 19:32:01,이나람,"네, 주말에 뵙겠습니다. 모두 파이팅!"
2021-12-11 19:33:39,박다람,"우리의 첫 프로젝트, 정말 기대돼요. 주말에 만나요, 모두 파이팅!"
2021-12-11 19:36:17,김가람,"다음 모임에서 모두의 멋진 아이디어를 듣고 싶어요. 주말에 봐요, 파이팅!"
2021-12-11 19:39:13,박다람,"주말에 만나서 우리가 배운 내용을 공유하고, 첫 프로젝트에 대한 계획을 세우는 건 정말 설레네요. 각자 준비한 내용을 어떻게 프로젝트에 적용할지 논의하는 시간을 가지면 좋겠어요."
2021-12-11 19:43:13,김가람,"네, 모두가 준비한 내용을 바탕으로 첫 회의를 통해 프로젝트의 방향을 잡아보아요. 기후 변화 데이터를 어떻게 분석할지, 어떤 결과를 도출하고 싶은지 등에 대한 아이디어를 공유해봅시다."
2021-12-11 19:44:57,이나람,"그리고 각자가 어떤 부분에서 어려움을 겪었는지, 어떻게 해결했는지도 나누어보면 서로에게 많은 도움이 될 거예요. 이런 과정을 통해 우리 모두가 함께 성장할 수 있을 거라고 생각해요."
2021-12-11 19:48:07,박다람,"네, 그렇게 서로의 경험을 공유하고, 함께 해결책을 찾아가는 과정이 정말 중요한 것 같아요. 우리의 첫 프로젝트가 서로에게 좋은 학습의 기회가 될 거라고 믿습니다."
2021-12-11 19:50:07,김가람,"저도 동의해요. 우리가 가진 다양한 아이디어와 접근 방식을 모아서, 멋진 결과물을 만들어냅시다. 이번 프로젝트를 통해 파이썬과 데이터 분석에 대한 우리의 이해도가 더 깊어지길 바라요."
2021-12-11 19:52:43,이나람,"맞아요, 이번 프로젝트를 시작으로 데이터 분석의 세계에 한 걸음 더 다가가는 계기가 되었으면 좋겠어요. 우리가 분석할 데이터를 통해 의미 있는 인사이트를 발견할 수 있길 바랍니다."
2021-12-11 19:55:45,박다람,"저도요. 우리의 노력과 시간이 결실을 맺어서, 우리 모두에게 값진 경험이 되기를 바랍니다. 이번 주말에 뵙겠습니다, 모두 파이팅!"
2021-12-11 19:58:45,김가람,"네, 모두들 이번 주말에 만나서 우리의 첫 프로젝트를 위한 멋진 시작을 함께 해요. 파이팅입니다!"
2021-12-11 20:02:29,이나람,"파이팅! 주말에 모두 건강한 모습으로 만나요. 이번 프로젝트를 통해 많이 배우고, 함께 성장할 수 있는 시간이 되길 기대해요."
2021-12-11 20:06:03,박다람,정말 기대되네요. 다들 준비 잘 하고 주말에 만나요. 파이팅!
